Framework requirement,Title,Description,Domain
A.5.1,Policies for information security,"Information security policy and topic-specific policies shall be defined, approved by management, published, communicated to and acknowledged by relevant personnel and relevant interested parties, and reviewed at planned intervals and if significant changes occur.",SECURITY_PRIVACY_GOVERNANCE
A.5.10,Acceptable use of information and other associated assets,"Rules for the acceptable use and procedures for handling information and other associated assets shall be identified, documented and implemented.",DATA_CLASSIFICATION_HANDLING
A.5.11,Return of assets,"Personnel and other interested parties as appropriate shall return all the organization’s assets in their possession upon change or termination of their employment, contract or agreement.",ASSET_MANAGEMENT
A.5.12,Classification of information,"Information shall be classified according to the information security needs of the organization based on confidentiality, integrity, availability and relevant interested party requirements.",DATA_CLASSIFICATION_HANDLING
A.5.13,Labelling of information,An appropriate set of procedures for information labelling shall be developed and implemented in accordance with the information classification scheme adopted by the organization.,DATA_CLASSIFICATION_HANDLING
A.5.14,Information transfer,"Information transfer rules, procedures, or agreements shall be in place for all types of transfer facilities within the organization and between the organization and other parties.",CRYPTOGRAPHIC_PROTECTIONS
A.5.15,Access control,Rules to control physical and logical access to information and other associated assets shall be established and implemented based on business and information security requirements.,IDENTIFICATION_AUTHENTICATION
A.5.16,Identity management,The full life cycle of identities shall be managed.,IDENTIFICATION_AUTHENTICATION
A.5.17,Authentication information,"Allocation and management of authentication information shall be controlled by a management process, including advising personnel on the appropriate handling of authentication information.",IDENTIFICATION_AUTHENTICATION
A.5.18,Access rights,"Access rights to information and other associated assets shall be provisioned, reviewed, modified and removed in accordance with the organization’s topic-specific policy on and rules for access control.",IDENTIFICATION_AUTHENTICATION
A.5.19,Information security in supplier relationships,Processes and procedures shall be defined and implemented to manage the information security risks associated with the use of supplier’s products or services.,THIRD_PARTY_MANAGEMENT
A.5.2,Information security roles and responsibilities,Information security roles and responsibilities shall be defined and allocated according to the organization needs.,HUMAN_RESOURCES_SECURITY
A.5.20,Addressing information security within supplier agreements,Relevant information security requirements shall be established and agreed with each supplier based on the type of supplier relationship.,INCIDENT_RESPONSE
A.5.21,Managing information security in the ICT supply chain,Processes and procedures shall be defined and implemented to manage the information security risks associated with the ICT products and services supply chain.,THIRD_PARTY_MANAGEMENT
A.5.22,"Monitoring, review and change management of supplier services","The organization shall regularly monitor, review, evaluate and manage change in supplier information security practices and service delivery.",THIRD_PARTY_MANAGEMENT
A.5.23,Information security for use of cloud services,"Processes for acquisition, use, management and exit from cloud services shall be established in accordance with the organization’s information security requirements.",CLOUD_SECURITY
A.5.24,Information security incident management planning and preparation,"The organization shall plan and prepare for managing information security incidents by defining, establishing and communicating information security incident management processes, roles and responsibilities.",INCIDENT_RESPONSE
A.5.25,Assessment and decision on information security events,The organization shall assess information security events and decide if they are to be categorized as information security incidents.,INCIDENT_RESPONSE
A.5.26,Response to information security incidents,Information security incidents shall be responded to in accordance with the documented procedures.,INCIDENT_RESPONSE
A.5.27,Learning from information security incidents,Knowledge gained from information security incidents shall be used to strengthen and improve the information security controls.,INCIDENT_RESPONSE
A.5.28,Collection of evidence,"The organization shall establish and implement procedures for the identification, collection, acquisition and preservation of evidence related to information security events.",INCIDENT_RESPONSE
A.5.29,Information security during disruption,The organization shall plan how to maintain information security at an appropriate level during disruption.,INCIDENT_RESPONSE
A.5.3,Segregation of duties,Conflicting duties and conflicting areas of responsibility shall be segregated.,HUMAN_RESOURCES_SECURITY
A.5.30,ICT readiness for business continuity,"ICT readiness shall be planned, implemented, maintained and tested based on business continuity objectives and ICT continuity requirements.",BUSINESS_CONTINUITY_DISASTER_RECOVERY
A.5.31,"Legal, statutory, regulatory and contractual requirements","Legal, statutory, regulatory and contractual requirements relevant to information security and the organization’s approach to meet these requirements shall be identified, documented and kept up to date.",COMPLIANCE
A.5.32,Intellectual property rights,The organization shall implement appropriate procedures to protect intellectual property rights.,ASSET_MANAGEMENT
A.5.33,Protection of records,"Records shall be protected from loss, destruction, falsification, unauthorized access and unauthorized release.",DATA_CLASSIFICATION_HANDLING
A.5.34,Privacy and protection of PII,The organization shall identify and meet the requirements regarding the preservation of privacy and protection of PII according to applicable laws and regulations and contractual requirements.,PRIVACY
A.5.35,Independent review of information security,"The organization’s approach to managing information security and its implementation including people, processes and technologies shall be reviewed independently at planned intervals, or when significant changes occur.",COMPLIANCE
A.5.36,"Compliance with policies, rules and standards for information security","Compliance with the organization’s information security policy, topic-specific policies, rules and standards shall be regularly reviewed.",COMPLIANCE
A.5.37,Documented operating procedures,Operating procedures for information processing facilities shall be documented and made available to personnel who need them.,SECURITY_PRIVACY_GOVERNANCE
A.5.4,Management responsibilities,"Management shall require all personnel to apply information security in accordance with the established information security policy, topic-specific policies and procedures of the organization.",SECURITY_PRIVACY_GOVERNANCE
A.5.5,Contact with authorities,The organization shall establish and maintain contact with relevant authorities.,SECURITY_PRIVACY_GOVERNANCE
A.5.6,Contact with special interest groups,The organization shall establish and maintain contact with special interest groups or other specialist security forums and professional associations.,SECURITY_PRIVACY_GOVERNANCE
A.5.7,Threat Intelligence,Information relating to information security threats shall be collected and analyzed to produce threat intelligence.,THREAT_MANAGEMENT
A.5.8,Information security in project management,Information security shall be integrated into project management.,PROJECT_RESOURCE_MANAGEMENT
A.5.9,Inventory of information and other associated assets,"An inventory of information and other associated assets, including owners, shall be developed and maintained.",ASSET_MANAGEMENT
A.6.1,Screening,"Background verification checks on all candidates to become personnel shall be carried out prior to joining the organization and on an ongoing basis taking into consideration applicable laws, regulations and ethics and be proportional to the business requirements, the classification of the information to be accessed and the perceived risks.",HUMAN_RESOURCES_SECURITY
A.6.2,Terms and conditions of employment,The employment contractual agreements shall state the personnel’s and the organization’s responsibilities for information security.,HUMAN_RESOURCES_SECURITY
A.6.3,"Information security awareness, education and training","Personnel of the organization and relevant interested parties shall receive appropriate information security awareness, education and training and regular updates of the organization's information security policy, topic-specific policies and procedures, as relevant for their job function.",SECURITY_AWARENESS_TRAINING
A.6.4,Disciplinary process,A disciplinary process shall be formalized and communicated to take actions against personnel and other relevant interested parties who have committed an information security policy violation,HUMAN_RESOURCES_SECURITY
A.6.5,Responsibilities after termination or change of employment,"Information security responsibilities and duties that remain valid after termination or change of employment shall be defined, enforced and communicated to relevant personnel and other interested parties.",HUMAN_RESOURCES_SECURITY
A.6.6,Confidentiality or non-disclosure agreements,"Confidentiality or non-disclosure agreements reflecting the organization’s needs for the protection of information shall be identified, documented, regularly reviewed and signed by personnel and other relevant interested parties.",HUMAN_RESOURCES_SECURITY
A.6.7,Remote working,"Security measures shall be implemented when personnel are working remotely to protect information accessed, processed or stored outside the organization’s premises.",NETWORK_SECURITY
A.6.8,Information security event reporting,The organization shall provide a mechanism for personnel to report observed or suspected information security events through appropriate channels in a timely manner.,INCIDENT_RESPONSE
A.7.1,Physical security perimeters,Security perimeters shall be defined and used to protect areas that contain information and other associated assets.,PHYSICAL_ENVIRONMENTAL_SECURITY
A.7.10,Storage media,"Storage media shall be managed through their life cycle of acquisition, use, transportation and disposal in accordance with the organization’s classification scheme and handling requirements.",ASSET_MANAGEMENT
A.7.11,Supporting utilities,Information processing facilities shall be protected from power failures and other disruptions caused by failures in supporting utilities.,PHYSICAL_ENVIRONMENTAL_SECURITY
A.7.12,Cabling security,"Cables carrying power, data or supporting information services shall be protected from interception, interference or damage.",PHYSICAL_ENVIRONMENTAL_SECURITY
A.7.13,Equipment maintenance,"Equipment shall be maintained correctly to ensure availability, integrity and confidentiality of information.",MAINTENANCE
A.7.14,Secure disposal or re-use of equipment,Items of equipment containing storage media shall be verified to ensure that any sensitive data and licensed software has been removed or securely overwritten prior to disposal or re-use.,ASSET_MANAGEMENT
A.7.2,Physical entry,Secure areas shall be protected by appropriate entry controls and access points.,PHYSICAL_ENVIRONMENTAL_SECURITY
A.7.3,"Securing offices, rooms and facilities","Physical security for offices, rooms and facilities shall be designed and implemented.",PHYSICAL_ENVIRONMENTAL_SECURITY
A.7.4,Physical security monitoring,Premises shall be continuously monitored for unauthorized physical access.,PHYSICAL_ENVIRONMENTAL_SECURITY
A.7.5,Protecting against physical and environmental threats,"Protection against physical and environmental threats, such as natural disasters and other intentional or unintentional physical threats to infrastructure shall be designed and implemented.",PHYSICAL_ENVIRONMENTAL_SECURITY
A.7.6,Working in secure areas,Security measures for working in secure areas shall be designed and implemented.,PHYSICAL_ENVIRONMENTAL_SECURITY
A.7.7,Clear desk and clear screen,Clear desk rules for papers and removable storage media and clear screen rules for information processing facilities shall be defined and appropriately enforced.,PHYSICAL_ENVIRONMENTAL_SECURITY
A.7.8,Equipment siting and protection,Equipment shall be sited securely and protected.,PHYSICAL_ENVIRONMENTAL_SECURITY
A.7.9,Security of assets off-premises,Off-site assets shall be protected.,ASSET_MANAGEMENT
A.8.1,User endpoint devices,"Information stored on, processed by or accessible via user endpoint devices shall be protected.",ENDPOINT_SECURITY
A.8.10,Information deletion,"Information stored in information systems, devices or in any other storage media shall be deleted when no longer required.",DATA_CLASSIFICATION_HANDLING
A.8.11,Data masking,"Data masking shall be used in accordance with the organization’s topic-specific policy on access control and other related topic-specific policies, and business requirements, taking applicable legislation into consideration.",DATA_CLASSIFICATION_HANDLING
A.8.12,Data leakage prevention,"Data leakage prevention measures shall be applied to systems, networks and any other devices that process, store or transmit sensitive information.",DATA_CLASSIFICATION_HANDLING
A.8.13,Information backup,"Backup copies of information, software and systems shall be maintained and regularly tested in accordance with the agreed topic-specific policy on backup.",BUSINESS_CONTINUITY_DISASTER_RECOVERY
A.8.14,Redundancy of information processing facilities,Information processing facilities shall be implemented with redundancy sufficient to meet availability requirements.,BUSINESS_CONTINUITY_DISASTER_RECOVERY
A.8.15,Logging,"Logs that record activities, exceptions, faults and other relevant events shall be produced, stored, protected and analysed.",CONTINUOUS_MONITORING
A.8.16,Monitoring activities,"Networks, systems and applications shall be monitored for anomalous behaviour and appropriate actions taken to evaluate potential information security incidents.",CONTINUOUS_MONITORING
A.8.17,Clock synchronization,The clocks of information processing systems used by the organization shall be synchronized to approved time sources.,SECURE_ENGINEERING_ARCHITECTURE
A.8.18,Use of privileged utility programs,The use of utility programs that can be capable of overriding system and application controls shall be restricted and tightly controlled.,IDENTIFICATION_AUTHENTICATION
A.8.19,Installation of software on operational systems,Procedures and measures shall be implemented to securely manage software installation on operational systems.,CHANGE_MANAGEMENT
A.8.2,Privileged access rights,The allocation and use of privileged access rights shall be restricted and managed.,IDENTIFICATION_AUTHENTICATION
A.8.20,Networks security,"Networks and network devices shall be secured, managed and controlled to protect information in systems and applications.",NETWORK_SECURITY
A.8.21,Security of network services,"Security mechanisms, service levels and service requirements of network services shall be identified, implemented and monitored.",NETWORK_SECURITY
A.8.22,Segregation of networks,"Groups of information services, users and information systems shall be segregated in the organization’s networks.",NETWORK_SECURITY
A.8.23,Web filtering,Access to external websites shall be managed to reduce exposure to malicious content.,NETWORK_SECURITY
A.8.24,Use of cryptography,"Rules for the effective use of cryptography, including cryptographic key management, shall be defined and implemented.",CRYPTOGRAPHIC_PROTECTIONS
A.8.25,Secure development life cycle,Rules for the secure development of software and systems shall be established and applied.,TECHNOLOGY_DEVELOPMENT_ACQUISITION
A.8.26,Application security requirements,"Information security requirements shall be identified, specified and approved when developing or acquiring applications.",SECURE_ENGINEERING_ARCHITECTURE
A.8.27,Secure system architecture and engineering principles,"Principles for engineering secure systems shall be established, documented, maintained and applied to any information system development activities.",SECURE_ENGINEERING_ARCHITECTURE
A.8.28,Secure coding,Secure coding principles shall be applied to software development.,TECHNOLOGY_DEVELOPMENT_ACQUISITION
A.8.29,Security testing in development and acceptance,Security testing processes shall be defined and implemented in the development life cycle.,TECHNOLOGY_DEVELOPMENT_ACQUISITION
A.8.3,Information access restriction,Access to information and other associated assets shall be restricted in accordance with the established topic-specific policy on access control.,IDENTIFICATION_AUTHENTICATION
A.8.30,Outsourced development,"The organization shall direct, monitor and review the activities related to outsourced system development.",THIRD_PARTY_MANAGEMENT
A.8.31,"Separation of development, test and production environments","Development, testing and production environments shall be separated and secured.",TECHNOLOGY_DEVELOPMENT_ACQUISITION
A.8.32,Change management,Changes to information processing facilities and information systems shall be subject to change management procedures.,CHANGE_MANAGEMENT
A.8.33,Test information,"Test information shall be appropriately selected, protected and managed.",TECHNOLOGY_DEVELOPMENT_ACQUISITION
A.8.34,Protection of information systems during audit testing,Audit tests and other assurance activities involving assessment of operational systems shall be planned and agreed between the tester and appropriate management.,COMPLIANCE
A.8.4,Access to source code,"Read and write access to source code, development tools and software libraries shall be appropriately managed.",TECHNOLOGY_DEVELOPMENT_ACQUISITION
A.8.5,Secure authentication,Secure authentication technologies and procedures shall be implemented based on information access restrictions and the topic-specific policy on access control.,IDENTIFICATION_AUTHENTICATION
A.8.6,Capacity management,The use of resources shall be monitored and adjusted in line with current and expected capacity requirements.,CAPACITY_PERFORMANCE_PLANNING
A.8.7,Protection against malware,Protection against malware shall be implemented and supported by appropriate user awareness.,ENDPOINT_SECURITY
A.8.8,Management of technical vulnerabilities,"Information about technical vulnerabilities of information systems in use shall be obtained, the organization’s exposure to such vulnerabilities should be evaluated and appropriate measures should be taken.",VULNERABILITY_PATCH_MANAGEMENT
A.8.9,Configuration management,"Configurations, including security configurations, of hardware, software, services and networks shall be established, documented, implemented, monitored and reviewed.",CONFIGURATION_MANAGEMENT
C.10.1,Continual Improvement,"The organization shall continually improve the suitability, adequacy and effectiveness of the information security management system.",SECURITY_PRIVACY_GOVERNANCE
C.10.2,Nonconformity and corrective action,"When a Nonconformity occurs, the organization shall:

a) React to the nonconformity, and as applicable:
  1) take action to control and correct it;
  2) deal with the consequences

b) evaluate the need for action to eliminate the causes of nonconformity, in order that it does not recur or occur elsewhere, by;
  1) reviewing the nonconformity;
  2) determining the causes of the nonconformity; and
  3) determining if similar nonconformities exist, or could potentially occur

c) implement any action needed;

d) review the effectiveness of any corrective action taken; and

e) make changes to the information security management system, if necessary. 

Corrective actions shall be appropriate to the effects of the nonconformities encountered.

Documented information shall be available as evidence of:

f) The nature of the nonconformities and any subsequent actions taken,

g) the results of any corrective action.",COMPLIANCE
C.4.1,Understanding the organization and its context,The organization shall determine external and internal issues that are relevant to its purpose and that affect its ability to achieve the intended outcome(s) of its information security management system.,SECURITY_PRIVACY_GOVERNANCE
C.4.2,Understanding the needs of interested parties,"The organization shall determine: 

a) interested parties that are relevant to the information security management system; 

b) the relevant requirements of these interested parties; 

c) which of these requirements will be addressed through the information security management system.",SECURITY_PRIVACY_GOVERNANCE
C.4.3,Determining the scope of the information security management system,"The organization shall determine the boundaries and applicability of the information security management system to establish its scope. When determining this scope, the organization shall consider: 

a) the external and internal issues referred to in 4.1; 

b) the requirements referred to in 4.2; 

c) interfaces and dependencies between activities performed by the organization, and those that are performed by other organizations. 

The scope shall be available as documented information.",ASSET_MANAGEMENT
C.4.4,Information security management system,"The organization shall establish, implement, maintain and continually improve an information security management system, including the processes needed and their interactions, in accordance with the requirements of ISO 27001.",SECURITY_PRIVACY_GOVERNANCE
C.5.1,Leadership and commitment,"Top management shall demonstrate leadership and commitment with respect to the information security management system by: 

a) ensuring the information security policy and the information security objectives are established and are compatible with the strategic direction of the organization; 

b) ensuring the integration of the information security management system requirements into the organization’s processes; 

c) ensuring that the resources needed for the information security management system are available; 

d) communicating the importance of effective information security management and of conforming to the information security management system requirements; 

e) ensuring that the information security management system achieves its intended outcome(s); 

f) directing and supporting persons to contribute to the effectiveness of the information security management system; 

g) promoting continual improvement; and 

h) supporting other relevant management roles to demonstrate their leadership as it applies to their areas of responsibility.",SECURITY_PRIVACY_GOVERNANCE
C.5.2,Policy,"Top management shall establish an information security policy that: 

a) is appropriate to the purpose of the organization; 

b) includes information security objectives (see 6.2) or provides the framework for setting information security objectives; 

c) includes a commitment to satisfy applicable requirements related to information security; 

d) includes a commitment to continual improvement of the information security management system.

The information security policy shall: 

e) be available as documented information; 

f) be communicated within the organization; 

g) be available to interested parties, as appropriate.",SECURITY_PRIVACY_GOVERNANCE
C.5.3,"Organizational roles, responsibilities and authorities","Top management shall ensure that the responsibilities and authorities for roles relevant to information security are assigned and communicated within the organization. 

Top management shall assign the responsibility and authority for: 

a) ensuring that the information security management system conforms to the requirements of this document; 

b) reporting on the performance of the information security management system to top management.",SECURITY_PRIVACY_GOVERNANCE
C.6.1.1,General actions to address risks and opportunities,"When planning for the information security management system, the organization shall consider the issues referred to in 4.1 and the requirements referred to in 4.2 and determine the risks and opportunities that need to be addressed to: 

a) ensure the information security management system can achieve its intended outcome(s); 

b) prevent, or reduce, undesired effects; 

c) achieve continual improvement.

The organization shall plan: 

d) actions to address these risks and opportunities; and 

e) how to 
  1) integrate and implement the actions into its information security management system processes; and 
  2) evaluate the effectiveness of these actions",RISK_MANAGEMENT
