Framework requirement,Title,Description,Domain
C.6.1.2,Information security risk assessment,"The organization shall define and apply an information security risk assessment process that: 

a) establishes and maintains information security risk criteria that include: 
  1) the risk acceptance criteria; and 
  2) criteria for performing information security risk assessments; 

b) ensures that repeated information security risk assessments produce consistent, valid and comparable results; 

c) identifies the information security risks: 
  1) apply the information security risk assessment process to identify risks associated with the loss of confidentiality, integrity and availability for information within the scope of the information security management system; and 
  2) identify the risk owners; 

d) analyses the information security risks: 
  1) assess the potential consequences that would result if the risks identified in 6.1.2 c) 1) were to materialize; 
  2) assess the realistic likelihood of the occurrence of the risks identified in 6.1.2 c) 1); and 
  3) determine the levels of risk; 

e) evaluates the information security risks: 
  1) compare the results of risk analysis with the risk criteria established in 6.1.2 a); and 
  2) prioritize the analysed risks for risk treatment. 

The organization shall retain documented information about the information security risk assessment process.",RISK_MANAGEMENT
C.6.1.3,Information security risk treatment,"The organization shall define and apply an information security risk treatment process to: 

a) select appropriate information security risk treatment options, taking account of the risk assessment results; 

b) determine all controls that are necessary to implement the information security risk treatment option(s) chosen; 

c) compare the controls determined in 6.1.3 b) above with those in Annex A and verify that no necessary controls have been omitted; 

d) produce a Statement of Applicability that contains: 

— the necessary controls (see 6.1.3 b) and c)); 

  — justification for their inclusion; 

  — whether the necessary controls are implemented or not; and 

  — the justification for excluding any of the Annex A controls. 

e) formulate an information security risk treatment plan; and 

f) obtain risk owners’ approval of the information security risk treatment plan and acceptance of the residual information security risks. 

The organization shall retain documented information about the information security risk treatment process.",RISK_MANAGEMENT
C.6.2,Information security objective and planning to achieve them,"The organization shall establish information security objectives at relevant functions and levels. The information security objectives shall:

a) be consistent with the information security policy; 

b) be measurable (if practicable); 

c) take into account applicable information security requirements, and results from risk assessment and risk treatment; 

d) be monitored; 

e) be communicated; 

f) be updated as appropriate; 

g) be available as documented information. 

The organization shall retain documented information on the information security objectives. 

When planning how to achieve its information security objectives, the organization shall determine: 

h) what will be done; 

i) what resources will be required; 

j) who will be responsible; 

k) when it will be completed; and 

l) how the results will be evaluated.",SECURITY_PRIVACY_GOVERNANCE
C.6.3,Planning of Changes,"When the organization determines the need for changes to the information security management system, the changes shall be carried out in a planned manner.",CHANGE_MANAGEMENT
C.7.1,Resources,"The organization shall determine and provide the resources needed for the establishment, implementation, maintenance and continual improvement of the information security management system.",PROJECT_RESOURCE_MANAGEMENT
C.7.2,Competence,"The organization shall:

a) determine the necessary competence of person(s) doing work under its control that affects its information security performance; 

b) ensure that these persons are competent on the basis of appropriate education, training, or experience; 

c) where applicable, take actions to acquire the necessary competence, and evaluate the effectiveness of the actions taken; and 

d) retain appropriate documented information as evidence of competence.",HUMAN_RESOURCES_SECURITY
C.7.3,Awareness,"Persons doing work under the organization’s control shall be aware of:

a) the information security policy; 

b) their contribution to the effectiveness of the information security management system, including the benefits of improved information security performance; and 

c) the implications of not conforming with the information security management system requirements.",HUMAN_RESOURCES_SECURITY
C.7.4,Communication,"The organization shall determine the need for internal and external communications relevant to the information security management system including: 

a) on what to communicate;

b) when to communicate;

c) with whom to communicate;

d) how to communicate.",SECURITY_PRIVACY_GOVERNANCE
C.7.5.1,Documented information,"The organization’s information security management system shall include: 

a) documented information required by this document; and 

b) documented information determined by the organization as being necessary for the effectiveness of the information security management system.",SECURITY_PRIVACY_GOVERNANCE
C.7.5.2,Creating and Updating,"When creating and updating documented information the organization shall ensure appropriate:

a) identification and description (e.g. a title, date, author, or reference number);

b) format (e.g. language, software version, graphics) and media (e.g. paper, electronic); and

c) review and approval for suitability and adequacy.",SECURITY_PRIVACY_GOVERNANCE
C.7.5.3,Control of documented information,"Documented information required by the information security management system and by this document shall be controlled to ensure: 

a) it is available and suitable for use, where and when it is needed; and

b) it is adequately protected (e.g. from loss of confidentiality, improper use, or loss of integrity). 

For the control of documented information, the organization shall address the following activities, as applicable: 

c) distribution, access, retrieval and use;

d) storage and preservation, including the preservation of legibility;

e) control of changes (e.g. version control); and

f) retention and disposition. 

Documented information of external origin, determined by the organization to be necessary for the planning and operation of the information security management system, shall be identified as appropriate, and controlled.",SECURITY_PRIVACY_GOVERNANCE
C.8.1,Operation planning and control,"The organization shall plan, implement and control the processes needed to meet requirements, and to implement the actions determined in Clause 6, by:

— establishing criteria for the processes;

— implementing control of the processes in accordance with the criteria. 

Documented information shall be available to the extent necessary to have confidence that the processes have been carried out as planned. 

The organization shall control planned changes and review the consequences of unintended changes, taking action to mitigate any adverse effects, as necessary. 

The organization shall ensure that externally provided processes, products or services that are relevant to the information security management system are controlled.",SECURITY_OPERATIONS
C.8.2,Information security risk assessment,"The organization shall perform information security risk assessments at planned intervals or when significant changes are proposed or occur, taking account of the criteria established in 6.1.2 a). 

The organization shall retain documented information of the results of the information security risk assessments.",RISK_MANAGEMENT
C.8.3,Information security risk treatment,The organization shall retain documented information of the results of the information security risk treatment.,RISK_MANAGEMENT
C.9.1,"Monitoring, measurement, analysis, and evaluation","The organization shall determine:

a) what needs to be monitored and measured, including information security processes and controls; 

b) the methods for monitoring, measurement, analysis and evaluation, as applicable, to ensure valid results. The methods selected should produce comparable and reproducible results to be considered valid; 

c) when the monitoring and measuring shall be performed; 

d) who shall monitor and measure; 

e) when the results from monitoring and measurement shall be analyzed and evaluated; 

f) who shall analyze and evaluate these results. 

Documented information shall be available as evidence of the results. 

The organization shall evaluate the information security performance and the effectiveness of the information security management system.",SECURITY_PRIVACY_GOVERNANCE
C.9.2.1,Internal Audit - General,"The organization shall conduct internal audits at planned intervals to provide information on whether the information security management system: 

a) conforms to
  1) the organization’s own requirements for its information security management system; 
  2) the requirements of this document;

b) is effectively implemented and maintained.",COMPLIANCE
C.9.2.2,Internal Audit Program,"The organization shall plan, establish, implement and maintain an audit programme(s), including the frequency, methods, responsibilities, planning requirements and reporting. 

When establishing the internal audit programme(s), the organization shall consider the importance of the processes concerned and the results of previous audits. 

The organization shall: 

a) define the audit criteria and scope for each audit;
 
b) select auditors and conduct audits that ensure objectivity and the impartiality of the audit process; 

c) ensure that the results of the audits are reported to relevant management; 

Documented information shall be available as evidence of the implementation of the audit programme(s) and the audit results.",COMPLIANCE
C.9.3.1,Management review - General,"Top management shall review the organization's information security management system at planned intervals to ensure its continuing suitability, adequacy and effectiveness.",SECURITY_PRIVACY_GOVERNANCE
C.9.3.2,Management review inputs,"The management review shall include consideration of: 

a) the status of actions from previous management reviews; 

b) changes in external and internal issues that are relevant to the information security management system; 

c) changes in needs and expectations of interested parties that are relevant to the information security management system; 

d) feedback on the information security performance, including trends in: 
  1) nonconformities and corrective actions;
  2) monitoring and measurement results;
  3) audit results; 
  4) fulfilment of information security objectives;

e) feedback from interested parties;

f) results of risk assessment and status of risk treatment plan; 

g) opportunities for continual improvement.",SECURITY_PRIVACY_GOVERNANCE
C.9.3.3,Management review results,"The results of the management review shall include decisions related to continual improvement opportunities and any needs for changes to the information security management system.

Documented information shall be available as evidence of the results of management reviews.",SECURITY_PRIVACY_GOVERNANCE